{"format_version": "0.1", "page": {"width": 80, "height": 60}, "components": [{"id": "c_battery001", "type": "dc-source", "position": {"x": 4, "y": 20}, "rotation": 0, "properties": {"voltage": 9.0}, "reference": "P1"}, {"id": "c_switch0001", "type": "switch", "position": {"x": 12, "y": 10}, "rotation": 0, "properties": {"closed": true}, "reference": "K1"}, {"id": "c_resist0001", "type": "resistor", "position": {"x": 20, "y": 10}, "rotation": 0, "properties": {"resistance": 220.0, "rated_power": 0.25}, "reference": "R1"}, {"id": "c_ledlamp001", "type": "led", "position": {"x": 28, "y": 20}, "rotation": 0, "properties": {"forward_voltage": 2.0, "color": "rouge"}, "reference": "D1"}, {"id": "c_ground0001", "type": "ground", "position": {"x": 16, "y": 34}, "rotation": 0, "properties": {}}], "connections": [{"id": "e_wire000001", "a": {"kind": "terminal", "component_id": "c_battery001", "terminal_id": "positive"}, "b": {"kind": "terminal", "component_id": "c_switch0001", "terminal_id": "t1"}, "route": {"mode": "orthogonal", "points": []}}, {"id": "e_wire000002", "a": {"kind": "terminal", "component_id": "c_switch0001", "terminal_id": "t2"}, "b": {"kind": "terminal", "component_id": "c_resist0001", "terminal_id": "t1"}, "route": {"mode": "orthogonal", "points": []}}, {"id": "e_wire000003", "a": {"kind": "terminal", "component_id": "c_resist0001", "terminal_id": "t2"}, "b": {"kind": "terminal", "component_id": "c_ledlamp001", "terminal_id": "anode"}, "route": {"mode": "orthogonal", "points": []}}, {"id": "e_wire000004", "a": {"kind": "terminal", "component_id": "c_ledlamp001", "terminal_id": "cathode"}, "b": {"kind": "junction", "junction_id": "j_node000001"}, "route": {"mode": "orthogonal", "points": []}}, {"id": "e_wire000005", "a": {"kind": "junction", "junction_id": "j_node000001"}, "b": {"kind": "terminal", "component_id": "c_battery001", "terminal_id": "negative"}, "route": {"mode": "orthogonal", "points": []}}, {"id": "e_wire000006", "a": {"kind": "junction", "junction_id": "j_node000001"}, "b": {"kind": "terminal", "component_id": "c_ground0001", "terminal_id": "ref"}, "route": {"mode": "orthogonal", "points": []}}], "junctions": [{"id": "j_node000001", "position": {"x": 16, "y": 30}}], "annotations": [{"id": "a_note000001", "kind": "text", "position": {"x": 2, "y": 2}, "text": "Témoin LED µA Ω"}]}